{
  "adapters": [
    {
      "agent": "antigravity",
      "config_tiers": [
        {
          "format": "json",
          "holds": [
            "hooks"
          ],
          "paths": {
            "any": [
              "~/.gemini/config/hooks.json"
            ]
          },
          "tier": "user"
        },
        {
          "format": "json",
          "holds": [
            "hooks"
          ],
          "paths": {
            "any": [
              ".agents/hooks.json"
            ]
          },
          "requires_trust": true,
          "tier": "project"
        },
        {
          "format": "json",
          "holds": [
            "settings",
            "permissions"
          ],
          "paths": {
            "any": [
              "~/.gemini/antigravity-cli/settings.json"
            ]
          },
          "tier": "user"
        },
        {
          "format": "markdown",
          "holds": [
            "skills"
          ],
          "paths": {
            "any": [
              "~/.gemini/config/skills/*/SKILL.md",
              "~/.gemini/antigravity-cli/skills/*/SKILL.md"
            ]
          },
          "tier": "user"
        },
        {
          "format": "markdown",
          "holds": [
            "skills"
          ],
          "paths": {
            "any": [
              ".agents/skills/*/SKILL.md"
            ]
          },
          "tier": "project"
        }
      ],
      "detect": {
        "app_bundles": {
          "macos": [
            "/Applications/Antigravity.app"
          ]
        },
        "binaries": [
          "agy"
        ],
        "bypass_flags": [
          "--dangerously-skip-permissions"
        ],
        "processes": [
          "agy",
          "Antigravity"
        ],
        "version_cmd": [
          "agy",
          "--version"
        ]
      },
      "display_name": "Antigravity",
      "hooks": {
        "events": [
          {
            "matcher": "*",
            "name": "PreToolUse",
            "request": {
              "cwd": "/workspacePaths/0",
              "session_id": "/conversationId",
              "tool_input": "/toolCall/args",
              "tool_name": "/toolCall/name"
            },
            "responses": {
              "allow": {
                "exit_code": 0,
                "stdout": {
                  "decision": "allow"
                }
              },
              "ask": {
                "exit_code": 0,
                "stdout": {
                  "decision": "force_ask",
                  "reason": "{message}"
                }
              },
              "deny": {
                "exit_code": 0,
                "stdout": {
                  "decision": "deny",
                  "reason": "{message}"
                }
              }
            },
            "role": "pre_tool",
            "verdicts": [
              "allow",
              "ask",
              "deny"
            ]
          },
          {
            "matcher": "*",
            "name": "PostToolUse",
            "request": {
              "cwd": "/workspacePaths/0",
              "session_id": "/conversationId",
              "tool_input": "/toolCall/args",
              "tool_name": "/toolCall/name"
            },
            "responses": {
              "none": {
                "exit_code": 0,
                "stdout": {}
              }
            },
            "role": "post_tool",
            "verdicts": []
          },
          {
            "name": "SessionStart",
            "request": {
              "cwd": "/workspacePaths/0",
              "session_id": "/conversationId"
            },
            "responses": {
              "none": {
                "exit_code": 0,
                "stdout": {}
              }
            },
            "role": "session_start",
            "verdicts": []
          }
        ],
        "fail_closed_option": null,
        "install": {
          "free": {
            "paths": {
              "any": [
                "~/.gemini/config/hooks.json"
              ]
            },
            "tier": "user"
          }
        },
        "registration": "antigravity_hooks",
        "timeout_seconds": 10,
        "trust": {
          "required": false
        }
      },
      "mcp_sources": [
        {
          "format": "json",
          "paths": {
            "any": [
              "~/.gemini/config/mcp_config.json"
            ]
          },
          "pointer": "/mcpServers",
          "tier": "user"
        },
        {
          "format": "json",
          "paths": {
            "any": [
              ".agents/mcp_config.json"
            ]
          },
          "pointer": "/mcpServers",
          "tier": "project"
        }
      ],
      "memory_files": [
        {
          "format": "markdown",
          "imports": true,
          "kind": "instructions",
          "paths": {
            "any": [
              "~/.gemini/AGENTS.md",
              "~/.gemini/GEMINI.md",
              "~/.gemini/config/AGENTS.md",
              "~/.gemini/config/GEMINI.md"
            ]
          },
          "tier": "user"
        },
        {
          "format": "markdown",
          "kind": "rules",
          "note": "Each rule file needs frontmatter with a trigger (always_on, model_decision, glob or manual); files without it are ignored.",
          "paths": {
            "any": [
              "~/.gemini/config/rules/*.md",
              "~/.gemini/antigravity-cli/rules/*.md"
            ]
          },
          "tier": "user"
        },
        {
          "format": "markdown",
          "imports": true,
          "kind": "instructions",
          "nested": true,
          "note": "Loaded for the folder of every file the agent reads or edits, up to the workspace root.",
          "paths": {
            "any": [
              "AGENTS.md",
              "GEMINI.md",
              ".agents/AGENTS.md",
              ".agents/GEMINI.md"
            ]
          },
          "tier": "project"
        },
        {
          "format": "markdown",
          "kind": "rules",
          "paths": {
            "any": [
              ".agents/rules/*.md"
            ]
          },
          "tier": "project"
        }
      ],
      "notes": [
        "The global hooks file is shared by the agy CLI, the desktop app and the IDE, so one install covers all three. Workspace hooks load only in trusted folders.",
        "A PreToolUse hook that crashes, times out or exits non-zero blocks the call (reported from testing with agy 1.1.21, not documented).",
        "--dangerously-skip-permissions skips PreToolUse hooks entirely.",
        "MCP tools appear under their own names, without the server, so MCP calls are classified as other.",
        "Hooks run with only allowed environment variables; privometry-hook finds the home folder from the account database when HOME is missing."
      ],
      "posture_checks": [
        "auto_approve_mode",
        "project_mcp_server",
        "unpinned_mcp_server",
        "project_hook",
        "secret_in_config"
      ],
      "schema": "privometry.adapter/v1",
      "tool_kinds": {
        "*": "other",
        "find_by_name": "file_read",
        "grep_search": "file_read",
        "invoke_subagent": "subagent_spawn",
        "list_dir": "file_read",
        "multi_replace_file_content": "file_write",
        "read_url_content": "network_fetch",
        "replace_file_content": "file_write",
        "run_command": "shell_exec",
        "search_web": "web_search",
        "view_file": "file_read",
        "write_to_file": "file_write"
      },
      "tool_targets": {
        "find_by_name": {
          "path": "/SearchDirectory"
        },
        "grep_search": {
          "path": "/SearchPath"
        },
        "list_dir": {
          "path": "/DirectoryPath"
        },
        "multi_replace_file_content": {
          "content": "/ReplacementChunks",
          "path": "/TargetFile"
        },
        "read_url_content": {
          "url": "/Url"
        },
        "replace_file_content": {
          "content": "/ReplacementContent",
          "path": "/TargetFile"
        },
        "run_command": {
          "command": "/CommandLine"
        },
        "search_web": {
          "query": "/query"
        },
        "view_file": {
          "path": "/AbsolutePath"
        },
        "write_to_file": {
          "content": "/CodeContent",
          "path": "/TargetFile"
        }
      },
      "verified": [],
      "versions": "\u003e=1.1.21 \u003c2.0.0"
    },
    {
      "agent": "claude_code",
      "config_tiers": [
        {
          "format": "json",
          "holds": [
            "settings",
            "permissions",
            "hooks",
            "plugins"
          ],
          "paths": {
            "any": [
              "~/.claude/settings.json"
            ]
          },
          "tier": "user"
        },
        {
          "format": "json",
          "holds": [
            "plugins"
          ],
          "paths": {
            "any": [
              "~/.claude/plugins/installed_plugins.json"
            ]
          },
          "tier": "user"
        },
        {
          "format": "json",
          "holds": [
            "settings",
            "permissions",
            "hooks",
            "plugins"
          ],
          "paths": {
            "any": [
              ".claude/settings.json",
              ".claude/settings.local.json"
            ]
          },
          "tier": "project"
        },
        {
          "format": "json",
          "holds": [
            "settings",
            "permissions",
            "hooks"
          ],
          "paths": {
            "linux": [
              "/etc/claude-code/managed-settings.json",
              "/etc/claude-code/managed-settings.d/*.json"
            ],
            "macos": [
              "/Library/Application Support/ClaudeCode/managed-settings.json",